category,title,url,description
工具操作,足幾分板是什麼？這影片告訴你！,https://youtu.be/4eWtbt1DsLU,
工具操作,釘槍不只帥，還超好用！,https://youtu.be/rAuk2qK-BRY,
工具操作,平土器到底在平啥？答案在這！,https://youtu.be/9Es8VaMrGPE,
工具操作,卷尺也有眉角？學起來別丟臉！,https://youtu.be/vhE16_8eh9g,
工具操作,你知道文公尺的規律嗎？ 看完包學會！,https://youtu.be/8y5Uulpld2k,
工具操作,泥作工具太多？這裡幫你搞懂！,https://youtu.be/kzZ4wXOpRw4,
工具操作,工具術語太複雜？一看就秒懂！,https://youtu.be/hy6KP-TJvyM,
建材選擇,夾板厚度怎麼挑？別被老闆唬爛！,https://youtu.be/ZTtns0-nIcQ,
建材選擇,鑿面切磚這麼簡單？看完秒會！,https://youtu.be/YealWFoQUgs,
建材選擇,手提修邊機超神！不用工具人也能上手！,https://youtu.be/RyxE_6DPcGM,
建材選擇,紅磚牆很讚？缺點你搞清楚沒？,https://youtu.be/ZzP_sk4tefU,
施工細節,化糞池虎邊放？這是裝修人的小撇步！,https://youtu.be/F7xVuDDCCzc,
施工細節,木作隔間超簡單，上集,https://youtu.be/7x383cfXMzQ,
施工細節,木作隔間超簡單，下集,https://youtu.be/kdl7ade-xSA,
施工細節,防火填塞這麼猛！用對材料超安心！,https://youtu.be/XhwjdtcFcao,
施工細節,防火門該怎麼選？影片裡教你套路！,https://youtu.be/YqvhJnB-thE,
施工細節,浴室裝修小細節，沒注意就GG啦！,https://youtu.be/WTYfoTwF16s,
施工細節,房間鉸鏈後鈕的位置怎麼裝？,https://youtu.be/-Wow4mRcv34,
修復保養,磁磚空股修復術，省錢又好用！,https://youtu.be/4YB2_9_TnM8,
修復保養,老屋壁癌？教你一招徹底解決！,https://youtu.be/fiWYdCzt5C4,
美觀收尾,家中油漆顏色怎麼挑？別被老婆罵爆！,https://youtu.be/kc2Y1QcQo8Y,
美觀收尾,燈具選得好，家裡一秒高級化！,https://youtu.be/73Zh6fl4swg,
美觀收尾,燈泡怎麼選？別裝完才傻眼！,https://youtu.be/py8hlbc3AOs,
專業術語,裝修術語 EP1,https://youtu.be/6KX92XCtI_M,
專業術語,裝修術語 EP2,https://youtu.be/zmNxH6VOFAI,
專業術語,裝修術語 EP3,https://youtu.be/hy6KP-TJvyM,
專業術語,裝修術語 EP4,https://youtu.be/eC52Ms4yUUQ,
專業術語,裝修術語 EP5,https://youtu.be/slOg4hzJjQE,
專業術語,裝修用語 EP6,https://youtu.be/kzZ4wXOpRw4,
專業術語,裝修用語 EP7,https://youtu.be/Kr2UQQI9ULs,
特殊施工,美耐板怎麼貼才牢？這裡有秘訣！上集,https://youtu.be/JDZxq_QDiT0,
特殊施工,美耐板怎麼貼才牢？這裡有秘訣！下集,https://youtu.be/KovKnsBF7Ic,
特殊施工,混凝土振動器好猛！讓結構更扎實！,https://youtu.be/VotM_pXBV2Q,
